{"$schema":"https://json-schema.org/draft/2020-12/schema","type":"object","required":["cycle_id","investigation_id","integrity_gates","information_value","method_learning","proposal","approval"],"properties":{"cycle_id":{"type":"string","pattern":"^improvement-cycle-"},"investigation_id":{"type":"string"},"integrity_gates":{"type":"object","required":["selection_quality","execution_integrity","claim_discipline"],"properties":{"selection_quality":{"enum":["pass","fail","partial"]},"execution_integrity":{"enum":["pass","fail","partial"]},"claim_discipline":{"enum":["pass","fail"]}}},"information_value":{"enum":["high","moderate","low","none"]},"method_learning":{"type":"array","minItems":1,"items":{"type":"string"}},"proposal":{"type":"object","required":["level","direction","scope"],"properties":{"level":{"enum":[0,1,2,3]},"direction":{"type":"string"},"scope":{"type":"string"}}},"approval":{"type":"object","required":["status","basis"],"properties":{"status":{"enum":["proposed","approved","rejected"]},"basis":{"type":"string"}}}},"additionalProperties":false}
